{
  "$schema": "https://json-schema.org/draft/2020-12/schema",
  "$id": "https://aijiaofu.example/schemas/v1/submission.schema.json",
  "title": "Canonical Submission v1",
  "type": "object",
  "additionalProperties": false,
  "required": [
    "schema_version",
    "environment",
    "organization_key",
    "workflow_template_key",
    "case_key",
    "subject",
    "source",
    "files"
  ],
  "properties": {
    "schema_version": { "const": "1.0" },
    "environment": { "enum": ["DEV", "UAT", "PROD"] },
    "organization_key": { "type": "string", "minLength": 1, "maxLength": 120 },
    "workflow_template_key": { "type": "string", "minLength": 1, "maxLength": 160 },
    "case_key": { "type": "string", "minLength": 1, "maxLength": 300 },
    "subject": {
      "type": "object",
      "additionalProperties": false,
      "required": ["subject_key"],
      "properties": {
        "subject_key": { "type": "string", "minLength": 1, "maxLength": 160 },
        "display_name": { "type": "string", "minLength": 1, "maxLength": 300 }
      }
    },
    "source": {
      "type": "object",
      "additionalProperties": false,
      "required": ["type", "submission_id", "received_at"],
      "properties": {
        "type": { "type": "string", "enum": ["fillout", "email", "api", "internal_upload"] },
        "connector_key": { "type": "string", "pattern": "^[a-z0-9][a-z0-9._-]{2,119}$", "maxLength": 120 },
        "submission_id": { "type": "string", "minLength": 1, "maxLength": 300 },
        "received_at": { "type": "string", "format": "date-time" },
        "source_reference": { "type": "string", "maxLength": 1000 }
      }
    },
    "business_context": {
      "type": "object",
      "additionalProperties": true,
      "properties": {
        "period": { "type": "string", "maxLength": 100 },
        "timezone": { "type": "string", "maxLength": 100 }
      }
    },
    "data_classification": {
      "type": "object",
      "additionalProperties": false,
      "required": ["mode"],
      "properties": {
        "mode": { "enum": ["synthetic_only", "real_data"] },
        "production_admission_policy_key": {
          "type": "string",
          "pattern": "^[a-z0-9][a-z0-9._-]{2,119}$",
          "maxLength": 120
        }
      },
      "allOf": [
        {
          "if": { "properties": { "mode": { "const": "real_data" } }, "required": ["mode"] },
          "then": {
            "properties": { "production_admission_policy_key": true },
            "required": ["production_admission_policy_key"]
          }
        }
      ]
    },
    "files": {
      "type": "array",
      "minItems": 1,
      "maxItems": 100,
      "items": {
        "type": "object",
        "additionalProperties": false,
        "required": ["original_filename", "download_url"],
        "properties": {
          "source_file_id": { "type": "string", "maxLength": 300 },
          "original_filename": { "type": "string", "minLength": 1, "maxLength": 500 },
          "download_url": { "type": "string", "format": "uri", "pattern": "^https://", "maxLength": 4000 },
          "declared_mime_type": { "type": "string", "maxLength": 200 },
          "declared_size_bytes": { "type": "integer", "minimum": 0 },
          "content_hash_sha256": { "type": "string", "pattern": "^[A-Fa-f0-9]{64}$" }
        }
      }
    }
  }
}
